<?xml version="1.0" encoding="UTF-8"?>
<!-- XML Sample Message of message hierarchy                                          -->
<!-- Message:             ADC PUR Orders v1.0 Rev. 2                                  -->
<!-- Transaction:         AA - Audit Data Collection Rev. 235                         -->
<!-- Datamodel:           Audit Data Collection Datamodel, version HEAD Rev. 312      -->
<!-- XML tagset used:     AdcsML                                                      -->
<!-- Generated at:        24-01-2021 12:54:59                                         -->
<!-- Generated using:     EC-Design 2.5.0 (http://www.ec-design.nl)                   -->
<!-- Generated by:        Jan Vrijenhoek (Digitect)                                   -->
<!-- Organisation:        Digitect B.V. (Digitect)                                    -->
<!-- NOTE:    This sample message was generated automatically: manual modifications will be lost -->
<AdcPurOrders xsi:schemaLocation="http://schemas.iso.org/AdcsML/Messages/AdcPurOrders-v1 AdcPurOrders-v1.0.xsd"
		xmlns="http://schemas.iso.org/AdcsML/Messages/AdcPurOrders-v1"
		xmlns:xsi="http://www.w3.org/2001/XMLSchema-instance">
	<PurOrd>
		<OrdId>ORD001</OrdId>
		<OrdNr>ORDER1234</OrdNr>
		<FiscYr>2020</FiscYr>
		<AcntingPer>M1</AcntingPer>
		<OrdTypNm>Short term delivery.</OrdTypNm>
		<OrdDt>2020-02-01</OrdDt>
		<OrgCd>BS001</OrgCd>
		<PurrId>E001</PurrId>
		<SuplAcntId>S00001</SuplAcntId>
		<SetlMthdCd>SC1</SetlMthdCd>
		<PayTermCd>PT1</PayTermCd>
		<OrdTrAmt>10000.0000</OrdTrAmt>
		<OrdTrCurCd>USD</OrdTrCurCd>
		<Stat>NEW</Stat>
		<Rmrk>Rush delivery.</Rmrk>
		<BusSgX>BS001</BusSgX>
		<Crea>
			<UserId>JD</UserId>
			<Dt>2020-03-02</Dt>
			<Tm>09:31</Tm>
		</Crea>
		<Aprv>
			<UserId>JD</UserId>
			<Dt>2020-03-02</Dt>
			<Tm>09:31</Tm>
		</Aprv>
		<LstMdf>
			<UserId>JD</UserId>
			<Dt>2020-03-02</Dt>
			<Tm>09:31</Tm>
		</LstMdf>
	</PurOrd>
</AdcPurOrders>
